{
  "schema_version": 1,
  "episode_date": "2026-09-25",
  "status": "pre_recording_preview_plan",
  "source": {
    "resolve_bridge_plan": "scripts/2026-09-25/resolve_bridge_plan.json",
    "timing_authority": "estimated_pre_recording_timeline"
  },
  "format": {
    "width": 960,
    "height": 540,
    "frame_rate_fps": 15,
    "video_codec": "libx264",
    "pixel_format": "yuv420p",
    "audio": "silent_aac_stereo"
  },
  "policy": {
    "layer_priority": [
      "V2",
      "V1"
    ],
    "resolved_broll_over_presenter": true,
    "missing_broll_slate_over_presenter": true,
    "watermark_required": true,
    "publishable": false,
    "frame_accurate": false,
    "requires_recording_retime": true
  },
  "summary": {
    "duration_seconds": 1018.4,
    "segment_count": 116,
    "presenter_seconds": 785.3,
    "broll_seconds": 233.1,
    "resolved_broll_seconds": 228.6,
    "placeholder_broll_seconds": 4.5,
    "broll_coverage_ratio": 0.2289
  },
  "segments": [
    {
      "segment_id": "preview_001",
      "placement_id": "aroll_001_opening_t01",
      "track_id": "V1",
      "take_id": "opening_t01",
      "cue_id": null,
      "timeline_start_seconds": 0.0,
      "timeline_end_seconds": 3.5,
      "duration_seconds": 3.5,
      "source_offset_seconds": 0.0,
      "logical_repo_path": "scripts/2026-09-25/placeholder_media/v1/opening_t01.png",
      "source_kind": "image",
      "placeholder": true
    },
    {
      "segment_id": "preview_002",
      "placement_id": "broll_001_slot_002",
      "track_id": "V2",
      "take_id": null,
      "cue_id": "slot_002",
      "timeline_start_seconds": 3.5,
      "timeline_end_seconds": 7.0,
      "duration_seconds": 3.5,
      "source_offset_seconds": 0.0,
      "logical_repo_path": "multimedia/2026-09-25/B00_opening__E_none/S002__0004-0007s__cinematic-close-up-hands-highlighting-research-n.mp4",
      "source_kind": "video",
      "placeholder": false
    },
    {
      "segment_id": "preview_003",
      "placement_id": "broll_002_slot_003",
      "track_id": "V2",
      "take_id": null,
      "cue_id": "slot_003",
      "timeline_start_seconds": 7.0,
      "timeline_end_seconds": 10.5,
      "duration_seconds": 3.5,
      "source_offset_seconds": 0.0,
      "logical_repo_path": "multimedia/2026-09-25/B00_opening__E_none/S003__0007-0010s__moving-archival-documents-handwritten-notes-desk.mp4",
      "source_kind": "video",
      "placeholder": false
    },
    {
      "segment_id": "preview_004",
      "placement_id": "broll_003_slot_004",
      "track_id": "V2",
      "take_id": null,
      "cue_id": "slot_004",
      "timeline_start_seconds": 10.5,
      "timeline_end_seconds": 14.0,
      "duration_seconds": 3.5,
      "source_offset_seconds": 0.0,
      "logical_repo_path": "multimedia/2026-09-25/B00_opening__E_none/S004__0010-0014s__investigative-evidence-wall-notes-connecting-lin.mp4",
      "source_kind": "video",
      "placeholder": false
    },
    {
      "segment_id": "preview_005",
      "placement_id": "broll_004_slot_005",
      "track_id": "V2",
      "take_id": null,
      "cue_id": "slot_005",
      "timeline_start_seconds": 14.0,
      "timeline_end_seconds": 17.5,
      "duration_seconds": 3.5,
      "source_offset_seconds": 0.0,
      "logical_repo_path": "multimedia/2026-09-25/B00_opening__E_none/S005__0014-0018s__abstract-flowing-data-traces-light-paths-cinemat.mp4",
      "source_kind": "video",
      "placeholder": false
    },
    {
      "segment_id": "preview_006",
      "placement_id": "broll_005_slot_006",
      "track_id": "V2",
      "take_id": null,
      "cue_id": "slot_006",
      "timeline_start_seconds": 17.5,
      "timeline_end_seconds": 20.0,
      "duration_seconds": 2.5,
      "source_offset_seconds": 0.0,
      "logical_repo_path": "multimedia/2026-09-25/B00_opening__E_none/S006__0018-0020s__person-carefully-reviewing-papers-computer-scree.mp4",
      "source_kind": "video",
      "placeholder": false
    },
    {
      "segment_id": "preview_007",
      "placement_id": "broll_006_slot_007",
      "track_id": "V2",
      "take_id": null,
      "cue_id": "slot_007",
      "timeline_start_seconds": 20.0,
      "timeline_end_seconds": 24.5,
      "duration_seconds": 4.5,
      "source_offset_seconds": 0.0,
      "logical_repo_path": "multimedia/2026-09-25/B00_opening__E_none/S007__0020-0024s__researcher-notes.jpg",
      "source_kind": "image",
      "placeholder": false
    },
    {
      "segment_id": "preview_008",
      "placement_id": "aroll_001_opening_t01",
      "track_id": "V1",
      "take_id": "opening_t01",
      "cue_id": null,
      "timeline_start_seconds": 24.5,
      "timeline_end_seconds": 30.0,
      "duration_seconds": 5.5,
      "source_offset_seconds": 24.5,
      "logical_repo_path": "scripts/2026-09-25/placeholder_media/v1/opening_t01.png",
      "source_kind": "image",
      "placeholder": true
    },
    {
      "segment_id": "preview_009",
      "placement_id": "broll_007_slot_008",
      "track_id": "V2",
      "take_id": null,
      "cue_id": "slot_008",
      "timeline_start_seconds": 30.0,
      "timeline_end_seconds": 34.5,
      "duration_seconds": 4.5,
      "source_offset_seconds": 0.0,
      "logical_repo_path": "multimedia/2026-09-25/B00_opening__E_none/S008__0030-0034s__researcher-notes-and-computer-close-up-documenta.mp4",
      "source_kind": "video",
      "placeholder": false
    },
    {
      "segment_id": "preview_010",
      "placement_id": "aroll_001_opening_t01",
      "track_id": "V1",
      "take_id": "opening_t01",
      "cue_id": null,
      "timeline_start_seconds": 34.5,
      "timeline_end_seconds": 36.8,
      "duration_seconds": 2.3,
      "source_offset_seconds": 34.5,
      "logical_repo_path": "scripts/2026-09-25/placeholder_media/v1/opening_t01.png",
      "source_kind": "image",
      "placeholder": true
    },
    {
      "segment_id": "preview_011",
      "placement_id": "aroll_002_opening_t02",
      "track_id": "V1",
      "take_id": "opening_t02",
      "cue_id": null,
      "timeline_start_seconds": 36.8,
      "timeline_end_seconds": 60.0,
      "duration_seconds": 23.2,
      "source_offset_seconds": 0.0,
      "logical_repo_path": "scripts/2026-09-25/placeholder_media/v1/opening_t02.png",
      "source_kind": "image",
      "placeholder": true
    },
    {
      "segment_id": "preview_012",
      "placement_id": "broll_008_slot_011",
      "track_id": "V2",
      "take_id": null,
      "cue_id": "slot_011",
      "timeline_start_seconds": 60.0,
      "timeline_end_seconds": 64.5,
      "duration_seconds": 4.5,
      "source_offset_seconds": 0.0,
      "logical_repo_path": "multimedia/2026-09-25/B00_opening__E_none/S011__0060-0064s__researcher-notes-and-computer-wide-documentary-s.jpg",
      "source_kind": "image",
      "placeholder": false
    },
    {
      "segment_id": "preview_013",
      "placement_id": "aroll_002_opening_t02",
      "track_id": "V1",
      "take_id": "opening_t02",
      "cue_id": null,
      "timeline_start_seconds": 64.5,
      "timeline_end_seconds": 66.0,
      "duration_seconds": 1.5,
      "source_offset_seconds": 27.7,
      "logical_repo_path": "scripts/2026-09-25/placeholder_media/v1/opening_t02.png",
      "source_kind": "image",
      "placeholder": true
    },
    {
      "segment_id": "preview_014",
      "placement_id": "broll_009_slot_012",
      "track_id": "V2",
      "take_id": null,
      "cue_id": "slot_012",
      "timeline_start_seconds": 66.0,
      "timeline_end_seconds": 70.5,
      "duration_seconds": 4.5,
      "source_offset_seconds": 0.0,
      "logical_repo_path": "multimedia/2026-09-25/B01_green-checkmark__E_none/S012__0066-0070s__abrir-con-la-escena-hipotetica-de-la-marca-verde.jpg",
      "source_kind": "image",
      "placeholder": false
    },
    {
      "segment_id": "preview_015",
      "placement_id": "aroll_003_b01_green_checkmark_t01",
      "track_id": "V1",
      "take_id": "b01_green_checkmark_t01",
      "cue_id": null,
      "timeline_start_seconds": 70.5,
      "timeline_end_seconds": 86.0,
      "duration_seconds": 15.5,
      "source_offset_seconds": 4.5,
      "logical_repo_path": "scripts/2026-09-25/placeholder_media/v1/b01_green_checkmark_t01.png",
      "source_kind": "image",
      "placeholder": true
    },
    {
      "segment_id": "preview_016",
      "placement_id": "broll_010_slot_014",
      "track_id": "V2",
      "take_id": null,
      "cue_id": "slot_014",
      "timeline_start_seconds": 86.0,
      "timeline_end_seconds": 90.5,
      "duration_seconds": 4.5,
      "source_offset_seconds": 0.0,
      "logical_repo_path": "multimedia/2026-09-25/B01_green-checkmark__E_none/S014__0086-0090s__researcher-working-with-notes-hands-working-deta.jpg",
      "source_kind": "image",
      "placeholder": false
    },
    {
      "segment_id": "preview_017",
      "placement_id": "aroll_003_b01_green_checkmark_t01",
      "track_id": "V1",
      "take_id": "b01_green_checkmark_t01",
      "cue_id": null,
      "timeline_start_seconds": 90.5,
      "timeline_end_seconds": 101.2,
      "duration_seconds": 10.7,
      "source_offset_seconds": 24.5,
      "logical_repo_path": "scripts/2026-09-25/placeholder_media/v1/b01_green_checkmark_t01.png",
      "source_kind": "image",
      "placeholder": true
    },
    {
      "segment_id": "preview_018",
      "placement_id": "aroll_004_b01_green_checkmark_t02",
      "track_id": "V1",
      "take_id": "b01_green_checkmark_t02",
      "cue_id": null,
      "timeline_start_seconds": 101.2,
      "timeline_end_seconds": 116.0,
      "duration_seconds": 14.8,
      "source_offset_seconds": 0.0,
      "logical_repo_path": "scripts/2026-09-25/placeholder_media/v1/b01_green_checkmark_t02.png",
      "source_kind": "image",
      "placeholder": true
    },
    {
      "segment_id": "preview_019",
      "placement_id": "broll_011_slot_017",
      "track_id": "V2",
      "take_id": null,
      "cue_id": "slot_017",